{
  "schema_version": "0.4",
  "card_id": "AIHD-PC-000003",
  "domain": "AI_AGENT_OPENCLAW",
  "revision": "1.0.0",
  "question": "OpenClaw Gateway 安装后，怎样确认服务真的运行并且 RPC 可用？",
  "aliases": [
    "openclaw gateway status 怎么看？",
    "小龙虾 gateway 装好了怎么验收？",
    "Gateway 显示 running 但连不上怎么办？",
    "怎样用 --require-rpc 验证 OpenClaw Gateway？"
  ],
  "scope_hint": "验证 OpenClaw Gateway 服务状态、连接握手与 RPC 读探针；不处理安装、重启或凭证分发。",
  "applies_to": [
    "OpenClaw Gateway 已安装，需要做只读运行验收",
    "服务状态看似正常，但需要确认 RPC 连接能力"
  ],
  "not_for": [
    "尚未安装 Gateway 或需要改变服务生命周期",
    "分享 token、password、远端 URL 或完整状态输出",
    "把会话列表存在误当成当前通道或 Gateway 健康"
  ],
  "answer": "先运行 `openclaw gateway status --require-rpc`。`gateway status` 会报告服务状态并进行连接探测；加入 `--require-rpc` 后，RPC 探测失败会让命令以非零状态退出，适合验收和自动化。若仍需诊断，使用只读的 `openclaw status --all` 查看本地汇总，或按范围选择 `openclaw health`。不要用重启证明健康，也不要把会话记录存在当成实时连接证据。JSON 状态可能包含网络或配置提示，分享前应先审查和脱敏。",
  "judgment_framework": [
    "服务层：受管服务是否存在并处于预期运行状态。",
    "连接层：CLI 能否完成到 Gateway 的可达性与认证握手。",
    "RPC 层：只读探针是否成功，而不只是进程存在。",
    "通道层：需要时再单独核对通道健康，不用会话行代替实时状态。"
  ],
  "common_mistakes": [
    "只看到进程或服务 running，就断言 RPC 已可用。",
    "用 stop/start 或 restart 作为第一步健康检查。",
    "把已有 session 行当成通道当前在线。",
    "把带网络、配置或认证信息的完整 JSON 状态直接公开。"
  ],
  "action_principles": [
    "验收先用只读状态和探针，生命周期变更另行授权。",
    "进程、连接、RPC 与通道健康分别记录，不互相替代。",
    "自动化验收依赖退出码；需要 RPC 时显式使用 `--require-rpc`。"
  ],
  "next_action": "在不附带 token、password 或自定义 URL 的前提下运行 `openclaw gateway status --require-rpc`，只记录退出码和是否通过 RPC 探针。",
  "verification_method": "命令退出码为 0，且状态同时显示服务与 RPC 探针成功，才把 Gateway 基础验收记为通过；任一失败保留原失败层级并进入只读诊断，不先重启。",
  "verification_steps": [
    "记录 OpenClaw 版本，不记录凭证或私有端点。",
    "运行 `openclaw gateway status --require-rpc`。",
    "分别记录服务状态、连接探测和 RPC 结果。",
    "若失败，运行只读的 `openclaw status --all` 或适用的 health 命令定位层级。",
    "分享诊断前删除网络、配置和认证细节。"
  ],
  "public_sources": [
    {
      "title": "OpenClaw：Gateway CLI",
      "url": "https://docs.openclaw.ai/cli/gateway",
      "checked_at": "2026-08-18"
    },
    {
      "title": "OpenClaw：Gateway health checks",
      "url": "https://docs.openclaw.ai/gateway/health",
      "checked_at": "2026-08-18"
    }
  ],
  "supported_versions": [
    "OpenClaw 2026.7.1-2 (0790d9f)"
  ],
  "last_verified": "2026-08-18",
  "editorial": "APPROVED",
  "verification": "PASS",
  "privacy_gate": "PASS",
  "publication": "READY"
}
