{
  "schema_version": "0.4",
  "card_id": "AIHD-PC-000006",
  "domain": "AI_AGENT_OPENCLAW",
  "revision": "1.0.0",
  "question": "OpenClaw 的 USER.md、MEMORY.md 和日期记忆应该怎样分层归档？",
  "aliases": [
    "MEMORY.md 太长了应该怎么拆？",
    "哪些内容放长期记忆，哪些放每日笔记？",
    "小龙虾的记忆文件怎样整理才不会越来越乱？",
    "怎样让旧记忆能检索，但不全部塞进上下文？"
  ],
  "scope_hint": "整理 OpenClaw 的 USER.md、MEMORY.md、日期记忆与受控原始证据，减少启动上下文膨胀并保持按需召回。",
  "applies_to": [
    "Agent 已积累跨会话事实、决定、偏好或工作记录",
    "MEMORY.md 变长、启动上下文被截断，或旧信息难以检索",
    "需要区分稳定用户资料、长期结论、日期工作记录和原始证据"
  ],
  "not_for": [
    "只存在于当前会话的临时推理，不需要跨会话保存",
    "需要法律、审计或取证意义上的原始记录；这应进入独立受控证据系统",
    "尚未确定谁可以看到记忆内容，或是否允许它进入模型上下文"
  ],
  "answer": "把记忆按稳定用户资料、长期可复用结论、日期工作记录和原始证据分开。稳定偏好、沟通方式和用户模型指令放在精简的 `USER.md`；跨会话仍成立的非档案事实、长期决定和短摘要放在 `MEMORY.md`；当天观察、过程记录和未沉淀上下文放在 `memory/YYYY-MM-DD.md`。今天和昨天的日期笔记会在裸 `/new` 或 `/reset` 时加载，其他详细工作记录主要通过 `memory_search` 或 `openclaw memory search` 按需召回。`MEMORY.md` 超过启动预算时，磁盘文件不会被删除，但注入上下文的副本会截断，因此应把细节移到日期工作层。只有反复验证、仍有效且应在启动时可见的内容才晋升回长期层。原始聊天、凭证和严格权限证据不进入普通记忆文件，只保留脱敏指针、结论和权限／到期边界。",
  "judgment_framework": [
    "稳定时间：跨会话稳定且经过确认的内容进入长期层；短期观察进入日期工作层。",
    "对象归属：稳定用户偏好进入 USER.md；非个人档案的项目事实和决定进入 MEMORY.md。",
    "启动必要性：只有每次新会话必须看到的内容才占用小而精的启动层，其他内容按需检索。",
    "权限与到期：可行动条件、Owner、来源和到期时间必须一起保存；条件不明则保持待核验。",
    "证据属性：原始证据保留在独立受控存储，记忆只登记脱敏指针和经过判断的结论。"
  ],
  "common_mistakes": [
    "把 MEMORY.md 当成逐日流水账，导致启动注入被截断。",
    "同一事实复制到多个记忆文件，之后无法判断哪一份更新。",
    "把一次对话中的猜测直接升级成长期事实。",
    "只保存结论，不保存 Owner、适用条件、到期时间或来源。",
    "把凭证、原始聊天或受限证据写进普通 Markdown 记忆。",
    "以为文件存在就一定进入当前上下文，未检查实际注入和检索状态。"
  ],
  "action_principles": [
    "长期层宁缺毋滥，只保留跨会话仍需默认可见的内容。",
    "工作层允许细节，但定期蒸馏、合并重复项并保留来源边界。",
    "事实、决定、推测和待核验项分开写。",
    "删除或改写原始证据前先确认保留政策；普通记忆不承担证据归档职责。",
    "用真实新会话和检索读回来验收，而不是只看文件写入成功。"
  ],
  "next_action": "从现有记忆中只选 1 条内容，判断它是否跨会话稳定、是否必须每次启动可见、是否带权限／到期、是否属于原始证据；据此只移动或重写这一条，并记录原位置、新位置和理由。",
  "verification_method": "先比较长期文件的磁盘大小、实际注入大小和截断状态，再检查记忆索引；随后用新会话验证长期结论能恢复，并区分今天／昨天日期笔记的预期启动加载与其他工作记录的按需召回。再用一个脱敏关键词证明工作层可检索。任何凭证、身份或原始私密消息被复制都算失败。文件结构与检索可用仍不证明内容真实、最新或获 Owner 认可。",
  "verification_steps": [
    "用 `/context list`、`/context detail` 或 `openclaw doctor` 检查长期文件的原始大小、实际注入和截断状态。",
    "用 `openclaw memory status` 检查记忆索引状态；需要时再使用 `--deep`。",
    "在一个新会话中验证长期结论能恢复，并确认今天／昨天日期笔记按预期加载，其他详细工作记录不被无条件注入。",
    "对工作层中的一个脱敏关键词执行记忆搜索，确认能按需找到相应条目。",
    "人工确认没有凭证、身份标识或原始私密消息被复制到新位置。"
  ],
  "public_sources": [
    {
      "title": "OpenClaw Memory overview",
      "url": "https://docs.openclaw.ai/concepts/memory",
      "checked_at": "2026-08-18"
    },
    {
      "title": "OpenClaw Memory search",
      "url": "https://docs.openclaw.ai/concepts/memory-search",
      "checked_at": "2026-08-18"
    },
    {
      "title": "OpenClaw Memory CLI",
      "url": "https://docs.openclaw.ai/cli/memory",
      "checked_at": "2026-08-18"
    }
  ],
  "supported_versions": [
    "OpenClaw official documentation checked 2026-08-18"
  ],
  "last_verified": "2026-08-18",
  "editorial": "APPROVED",
  "verification": "PASS",
  "privacy_gate": "PASS",
  "publication": "READY"
}
