{
  "schema_version": "0.4",
  "card_id": "AIHD-PC-000001",
  "domain": "AI_AGENT_OPENCLAW",
  "revision": "1.1.0",
  "question": "写进 AGENTS.md 的规则，怎样确认在 Codex 中生效？",
  "aliases": [
    "写进 AGENTS.md 为什么没生效？",
    "Codex 为什么不遵守已经写下的规则？",
    "怎样验证 Codex 已读取项目规则？",
    "怎样测试 AGENTS.md 规则有没有生效？"
  ],
  "scope_hint": "排查 Codex 是否发现、读取并触发普通 AGENTS.md 行为规则；不处理技术性权限阻断。",
  "applies_to": [
    "Codex 项目级 AGENTS.md 指令",
    "需要确认一条普通行为规则是否在新运行中被读取并触发"
  ],
  "not_for": [
    "保存个人事实或聊天记忆",
    "仅靠自然语言技术性阻断命令、文件写入或网络访问",
    "未确认 Codex 版本、启动目录或指令作用域的故障"
  ],
  "answer": "把‘生效’拆成三个可观察环节：文件被当前运行发现、指令进入适用的指令链、触发条件出现时产生预期行为。修改 AGENTS.md 后启动新的 Codex 运行；失败时依次检查启动目录、AGENTS.override.md、从项目根到当前目录的覆盖关系，再检查规则是否具体、是否冲突。文件存在、Codex 能复述规则或单次恰好做对，都不能证明规则稳定生效。用临时、无身份信息、无副作用的唯一探针，同时做应触发和不应触发的对照。若问题是命令、文件或网络访问被技术性阻断，转去检查 Rules、沙箱和审批策略，不要继续靠改写 AGENTS.md 解决。",
  "judgment_framework": [
    "发现：当前运行能否从启动目录找到适用的 AGENTS.md。",
    "适用：更近目录的指令或 AGENTS.override.md 是否覆盖了目标规则。",
    "触发：测试任务是否真的满足规则写明的触发条件。",
    "证据：正例与相似负例是否分别产生预期结果。"
  ],
  "common_mistakes": [
    "只确认文件存在，就断言当前运行已经读取。",
    "修改 AGENTS.md 后继续使用旧运行。",
    "只做应触发的正例，不做相似但不应触发的对照。",
    "把沙箱或审批阻断误判为自然语言规则没有被读取。"
  ],
  "action_principles": [
    "一次只验证一条规则，并把触发、范围、动作、证据和失败处理写清。",
    "探针应临时、无身份信息、无副作用，测试后删除。",
    "一次通过只归因于该路径和该次运行，不外推为永久保证。"
  ],
  "next_action": "挑一条最近失效的规则，按‘触发／范围／动作／证据／失败处理’五行重写，只测试这一条。",
  "verification_method": "在新的 Codex 运行中记录版本、启动目录和适用指令链；对同一条临时规则分别运行一个应触发任务和一个相似但不应触发任务。只有两者都符合预期，才把本次路径记为通过。",
  "verification_steps": [
    "记录 Codex 版本、启动目录和适用指令文件。",
    "用临时、无身份信息、无副作用的唯一探针改写这一条规则。",
    "修改后启动新的 Codex 运行，确认该指令出现在模型可见输入或等价诊断中。",
    "分别执行应触发的任务和相似但不应触发的对照任务。",
    "记录结果并删除探针；一次通过只归因于该路径和该次运行。"
  ],
  "public_sources": [
    {
      "title": "OpenAI Codex：Custom instructions with AGENTS.md",
      "url": "https://learn.chatgpt.com/docs/agent-configuration/agents-md",
      "checked_at": "2026-08-18"
    },
    {
      "title": "OpenAI Codex：Rules",
      "url": "https://learn.chatgpt.com/docs/agent-configuration/rules",
      "checked_at": "2026-08-18"
    },
    {
      "title": "OpenAI Codex：Sandbox",
      "url": "https://learn.chatgpt.com/docs/sandboxing",
      "checked_at": "2026-08-18"
    }
  ],
  "supported_versions": [
    "Codex CLI 0.148.0-alpha.9"
  ],
  "last_verified": "2026-08-18",
  "editorial": "APPROVED",
  "verification": "PASS",
  "privacy_gate": "PASS",
  "publication": "READY"
}
