{
  "schema_version": "0.4",
  "card_id": "AIHD-PC-000002",
  "domain": "AI_AGENT_OPENCLAW",
  "revision": "1.0.0",
  "question": "Codex 已读取 AGENTS.md，但命令仍被沙箱或审批阻断，应该怎么排查？",
  "aliases": [
    "Codex 明明读了规则为什么还是不能执行命令？",
    "命令被 sandbox 拒绝该怎么查？",
    "AGENTS.md 允许了为什么还要审批？",
    "怎样区分规则要求和沙箱硬限制？"
  ],
  "scope_hint": "排查已确认规则被读取后，命令、文件或网络访问仍被 Sandbox、Rules 或审批策略限制。",
  "applies_to": [
    "Codex 已发现并读取适用的 AGENTS.md，但具体操作仍被技术边界阻断",
    "需要区分自然语言指令、命令 Rules、沙箱能力和审批策略"
  ],
  "not_for": [
    "尚未确认 AGENTS.md 是否被当前运行发现",
    "请求绕过管理员策略、安全边界或明确禁止的操作",
    "把敏感命令、凭证或私有路径发给他人代跑"
  ],
  "answer": "AGENTS.md 约束模型怎样工作，但不能自行扩大进程的技术权限。沙箱决定命令可访问的文件、网络和系统范围；审批策略决定越界时是否必须停下；Rules 只对沙箱外命令给出 allow、prompt 或 forbidden 决策。先确认被拒的是哪一个精确操作，再看失败来自沙箱、审批还是匹配到的 Rule。不要继续用更强措辞改写 AGENTS.md，也不要把规则写成绕过硬边界的授权。若只需判断 Rule，使用无副作用的代表命令做 `codex execpolicy check`；若是沙箱或审批，查看当前运行显示的权限边界并把动作缩小到已授权范围。",
  "judgment_framework": [
    "指令层：AGENTS.md 是否只规定行为，而没有被误当成系统授权。",
    "沙箱层：目标文件、网络或系统资源是否在当前技术边界内。",
    "审批层：越界动作是否需要用户确认，当前策略是否允许提出确认。",
    "Rules 层：精确命令前缀是否命中 allow、prompt 或 forbidden。"
  ],
  "common_mistakes": [
    "把 AGENTS.md 中的‘允许执行’当成系统权限已经授予。",
    "命令被拒后反复改写自然语言规则，却不看精确阻断来源。",
    "用更宽的命令或组合 shell 尝试绕过原阻断。",
    "把含凭证、私有路径或破坏性动作的命令直接复制到调试材料。"
  ],
  "action_principles": [
    "先定位阻断层，再选择最小修复；不要同时改规则、沙箱和审批。",
    "测试命令必须无副作用，并与真实命令保持足够相似以验证匹配。",
    "forbidden 或管理员限制保持停止；需要新授权时明确向有权者请求。"
  ],
  "next_action": "记录一个被拒操作的精确命令类别和当前运行显示的阻断原因，只判断它属于 AGENTS.md、沙箱、审批还是 Rules 四层中的哪一层。",
  "verification_method": "对同一无副作用代表命令分别核对当前权限说明与 `codex execpolicy check` 结果；修复后只重试该代表命令。命令在预期边界内成功，且相似但仍应禁止的对照命令继续被拒，才算本次修复通过。",
  "verification_steps": [
    "确认当前运行已经读取适用的 AGENTS.md，避免与规则发现问题混淆。",
    "记录被拒操作属于文件、网络、命令还是系统资源，不记录敏感参数。",
    "查看当前运行显示的沙箱和审批边界。",
    "若怀疑 Rules，用无副作用的代表命令执行 `codex execpolicy check`。",
    "只修复定位到的一层，再做允许正例和禁止对照。"
  ],
  "public_sources": [
    {
      "title": "OpenAI Codex：Custom instructions with AGENTS.md",
      "url": "https://learn.chatgpt.com/docs/agent-configuration/agents-md",
      "checked_at": "2026-08-18"
    },
    {
      "title": "OpenAI Codex：Rules",
      "url": "https://learn.chatgpt.com/docs/agent-configuration/rules",
      "checked_at": "2026-08-18"
    },
    {
      "title": "OpenAI Codex：Sandbox",
      "url": "https://learn.chatgpt.com/docs/sandboxing",
      "checked_at": "2026-08-18"
    }
  ],
  "supported_versions": [
    "Codex CLI 0.148.0-alpha.9"
  ],
  "last_verified": "2026-08-18",
  "editorial": "APPROVED",
  "verification": "PASS",
  "privacy_gate": "PASS",
  "publication": "READY"
}
