{
  "schema_version": "0.4",
  "card_id": "AIHD-PC-000004",
  "domain": "AI_AGENT_OPENCLAW",
  "revision": "1.0.0",
  "question": "怎样让 OpenClaw Agent 形成受控自迭代闭环？",
  "aliases": [
    "怎样让我的小龙虾自迭代？",
    "OpenClaw 怎么从我的纠正中持续改进？",
    "怎样让 Agent 把真实经验沉淀成 Skill？",
    "如何让 OpenClaw 自动生成待审提案？"
  ],
  "scope_hint": "为已能正常运行的 OpenClaw Agent 接入经验捕获、待审 Skill 提案、多场景验证和 Owner 晋升；不支持无监督自改身份或自动应用提案。",
  "applies_to": [
    "已经有稳定主工作区和可检索记忆的 OpenClaw Agent",
    "希望从真实任务、纠正和结果回执中形成可复用 Skill 的个人 Agent",
    "要求所有行为变化仍经过人工批准并可回滚的自迭代流程"
  ],
  "not_for": [
    "训练或微调模型权重",
    "允许 Agent 无人审批地改写身份、长期规则或定时任务",
    "未核验当前工作区、运行版本和配置 schema 就恢复旧自动化脚本",
    "用记忆条数或提案数量代替真实任务效果验证"
  ],
  "answer": "把自迭代设计成受控晋升链，而不是让 Agent 自由改写自己。先确认实际运行的工作区、OpenClaw 版本、当前配置和可恢复快照；再让 Memory Core／Dreaming 只负责捕获和整理新经验，让 Skill Workshop 只自动生成 pending proposal，并保留人工 apply。用一次真实纠正触发提案，批准前确认活动 Skill 没有变化；批准后至少用两个不同但同类的真实任务验证，并分别记录结果。只有新策略在两次任务中都被实际调用且结果通过，才生成 Strategy Candidate，再由 Owner 决定是否晋升到 Skill 或长期规则。若没有捕获到经验、没有生成提案、验证失败或回滚不可用，就停在当前层修复，不能手写成功状态。配置字段可能随版本变化，落地前应以本机安装版本的文档和 dry-run 校验为准。",
  "judgment_framework": [
    "捕获：真实任务或明确纠正是否生成了可追溯的新经验，而不是只留在当前对话。",
    "隔离：自动化是否只生成待审提案，批准前不改变活动 Skill、身份文件或调度任务。",
    "消费：获批策略是否在后续不同场景中被实际调用，而不是只增加一条记忆。",
    "效果：至少两个不同真实任务是否各自留下可复验的结果回执。",
    "晋升：只有 Owner 能把通过验证的候选写入长期规则，并且每次变更都可回滚。"
  ],
  "common_mistakes": [
    "把每天新增的记忆、反思或提案数量当作自迭代效果。",
    "一开始就开启自动 apply，让未经验证的提案直接改变 Agent 行为。",
    "让自动化改写身份文件、核心规则或 Heartbeat，导致判断权和回滚边界消失。",
    "直接复活旧的 nightly iteration，却没有核对真实工作区、版本、状态和恢复能力。",
    "一次任务成功就永久晋升，没有做第二个不同场景的消费验证。"
  ],
  "action_principles": [
    "自动化只负责捕获和提案；应用、晋升和撤回保留给 Owner。",
    "一次只试一个真实纠正和一个提案，避免多个变化无法归因。",
    "每次写入前做可恢复快照，写入后读回并记录 hash 或等价收据。",
    "策略至少通过两个不同真实任务，失败、未知或证据缺失都不得晋升。",
    "先验证本机版本的配置 schema，再使用对应命令，不照抄漂移的在线示例。"
  ],
  "next_action": "先记录当前 OpenClaw 状态并制作可恢复快照，再用本机配置 dry-run 验证 Dreaming 和 Skill Workshop 的 pending-proposal 模式；只做一次真实纠正实验。",
  "verification_method": "比较实验前后的记忆状态、pending proposal 列表和活动 Skill 内容；批准前必须只有待审提案且活动文件不变，批准后必须在两个不同真实任务中观察到策略被调用并分别留下通过回执，同时完成一次可用的回滚读回。",
  "verification_steps": [
    "记录 OpenClaw 版本、实际主工作区、Gateway 状态、当前配置和活动 Skill hash。",
    "制作并验证配置与工作区的可恢复快照。",
    "按本机 schema 对 Dreaming 与 Skill Workshop pending 模式执行 dry-run，失败即停止。",
    "提交一次明确的真实纠正，确认只新增一个 pending proposal，活动 Skill hash 不变。",
    "人工批准该提案后，在两个不同但同类的真实任务中复跑并分别记录结果。",
    "若两次都通过，再生成 Strategy Candidate；否则撤回候选并验证恢复后的内容与状态。"
  ],
  "public_sources": [
    {
      "title": "OpenClaw：Dreaming",
      "url": "https://docs.openclaw.ai/concepts/dreaming",
      "checked_at": "2026-08-18"
    },
    {
      "title": "OpenClaw：Skill Workshop",
      "url": "https://docs.openclaw.ai/tools/skill-workshop",
      "checked_at": "2026-08-18"
    },
    {
      "title": "OpenClaw：Skills",
      "url": "https://docs.openclaw.ai/tools/skills",
      "checked_at": "2026-08-18"
    },
    {
      "title": "OpenClaw：Memory",
      "url": "https://docs.openclaw.ai/concepts/memory",
      "checked_at": "2026-08-18"
    }
  ],
  "supported_versions": [
    "OpenClaw 2026.7.1"
  ],
  "last_verified": "2026-08-18",
  "editorial": "APPROVED",
  "verification": "PASS",
  "privacy_gate": "PASS",
  "publication": "READY"
}
